{
  "exchangeId": "mexc",
  "countryCode": "KZ",
  "exchangeLegalEntity": null,
  "overallAvailability": "RESTRICTED",
  "registrationStatus": "RESTRICTED",
  "productStatuses": {
    "registration": "RESTRICTED",
    "kyc": "RESTRICTED",
    "spot": "RESTRICTED",
    "derivatives": "RESTRICTED",
    "margin": "RESTRICTED",
    "copy_trading": "RESTRICTED_WITH_PRODUCT_DETAIL_UNVERIFIED",
    "p2p": "CONFLICTING",
    "kzt_p2p": "CONFLICTING",
    "direct_kzt_deposit": "UNKNOWN",
    "direct_kzt_withdrawal": "UNKNOWN",
    "bank_card_purchase": "UNAVAILABLE",
    "mobile_application": "CONFLICTING",
    "earn": "CONFLICTING"
  },
  "rankingEligibility": false,
  "ctaEligibility": false,
  "promoEligibility": false,
  "confidence": "HIGH",
  "freshness": "UNDER_REVIEW",
  "checkedDate": "2026-07-22",
  "nextReviewDate": "2026-08-21",
  "reasonCodes": [
    "RESTRICTED_BY_CURRENT_TERMS_PROHIBITED_JURISDICTION",
    "AFSA_UNLICENSED_WARNING_SUPPORTING",
    "TERMS_PAGE_FLIP_MONITORING_REQUIRED",
    "CONFLICTING_PRODUCT_SIGNALS_PRESERVED",
    "DIRECT_FIAT_RAILS_UNVERIFIED",
    "REFERRAL_KZ_COMPATIBILITY_UNVERIFIED",
    "RECOVERED_PACKAGE_UNVERIFIED"
  ],
  "limitations": [
    "Package is a recovered delivery (RECOVERED / UNVERIFIED); byte-identical originality of the original review ZIP cannot be established.",
    "Terms-page flip requires monitoring: earlier captures (2026-07-03, 2026-07-14) reported Kazakhstan absent; the 2026-07-22 review found it present with the same displayed update date 2025-05-29.",
    "Direct KZT fiat deposit/withdrawal rails remain unverified.",
    "Kazakhstan compatibility of the repository referral route/code is not verified; repository route and code are implementation facts only.",
    "RESTRICTED is a legal/eligibility conclusion; technical site reachability from Kazakhstan was not determined."
  ],
  "sourceIds": [
    "src-kz-mexc-affiliate-fee-001",
    "src-kz-mexc-afsa-warning-001",
    "src-kz-mexc-app-countries-001",
    "src-kz-mexc-buy-guide-001",
    "src-kz-mexc-card-guide-001",
    "src-kz-mexc-cis-bonus-001",
    "src-kz-mexc-earn-agreement-001",
    "src-kz-mexc-fiat-tn-policy-001",
    "src-kz-mexc-invite-flow-001",
    "src-kz-mexc-kyc-documents-001",
    "src-kz-mexc-kyc-eligibility-001",
    "src-kz-mexc-p2p-ad-rules-001",
    "src-kz-mexc-p2p-kzt-page-001",
    "src-kz-mexc-referrer-linking-001",
    "src-kz-mexc-signup-flow-001",
    "src-kz-mexc-terms-001"
  ],
  "conflictIds": [
    "cf-kz-mexc-card-guide-scope",
    "cf-kz-mexc-global-referral-vs-kz-restriction",
    "cf-kz-mexc-terms-vs-app-support",
    "cf-kz-mexc-terms-vs-earn",
    "cf-kz-mexc-terms-vs-fiat-tn",
    "cf-kz-mexc-terms-vs-p2p-kzt",
    "cf-kz-mexc-terms-vs-regulator"
  ],
  "alternativeExchangeIds": [],
  "liveVerificationState": "NOT_LIVE_VERIFIED"
}
