{
  "exchangeId": "bybit",
  "countryCode": "KZ",
  "exchangeLegalEntity": "Bybit Limited (AIFC / AFSA AFSA-A-LA-2024-0027)",
  "overallAvailability": "AVAILABLE_WITH_LIMITS",
  "registrationStatus": "AVAILABLE_WITH_LIMITS",
  "productStatuses": {
    "registration": "AVAILABLE_WITH_LIMITS",
    "kyc": "AVAILABLE_WITH_LIMITS",
    "spot": "AVAILABLE",
    "derivatives": "AVAILABLE_WITH_LIMITS",
    "margin": "AVAILABLE_WITH_LIMITS",
    "p2p": "AVAILABLE_WITH_LIMITS",
    "kzt_p2p": "AVAILABLE",
    "direct_kzt_deposit": "AVAILABLE_WITH_LIMITS",
    "direct_kzt_withdrawal": "AVAILABLE_WITH_LIMITS",
    "bank_card_purchase": "CONFLICTING",
    "bybit_card": "AVAILABLE_WITH_LIMITS",
    "referral": "UNKNOWN",
    "promotions": "AVAILABLE_WITH_LIMITS"
  },
  "rankingEligibility": false,
  "ctaEligibility": false,
  "promoEligibility": false,
  "confidence": "MEDIUM",
  "freshness": "CURRENT",
  "checkedDate": "2026-07-21",
  "nextReviewDate": "2026-08-21",
  "reasonCodes": [
    "LOCAL_AIFC_LICENSED",
    "REGISTRATION_SCOPE_PARTIAL",
    "ROUTING_PARTIAL",
    "OFFER_ELIGIBILITY_UNVERIFIED",
    "NOT_LIVE_VERIFIED"
  ],
  "limitations": [
    "registration/residency/citizenship rules remain partially resolved",
    "bybit.kz is the confirmed local route for core trading and KZT rails, but some bybit.com / card / referral routing remains partially resolved",
    "global referral-code compatibility remains unverified",
    "Kazakhstan promotional eligibility is narrower than platform availability",
    "local promotional amounts exist, but they must not be confused with a globally advertised maximum",
    "liveVerificationState remains NOT_LIVE_VERIFIED"
  ],
  "sourceIds": [
    "src-kz-bybit-001",
    "src-kz-bybit-002",
    "src-kz-bybit-003",
    "src-kz-bybit-004",
    "src-kz-bybit-005",
    "src-kz-bybit-006",
    "src-kz-bybit-007",
    "src-kz-bybit-008",
    "src-kz-bybit-009",
    "src-kz-bybit-010",
    "src-kz-bybit-011",
    "src-kz-bybit-012",
    "src-kz-bybit-013",
    "src-kz-bybit-014",
    "src-kz-bybit-015",
    "src-kz-bybit-016",
    "src-kz-bybit-017",
    "src-kz-bybit-018",
    "src-kz-bybit-019",
    "src-kz-bybit-020",
    "src-kz-bybit-021",
    "src-kz-bybit-022",
    "src-kz-bybit-023",
    "src-kz-bybit-024",
    "src-kz-bybit-025",
    "src-kz-bybit-026",
    "src-kz-bybit-027",
    "src-kz-bybit-028",
    "src-kz-bybit-029",
    "src-kz-bybit-030",
    "src-kz-bybit-031",
    "src-kz-bybit-032",
    "src-kz-bybit-033",
    "src-kz-bybit-034",
    "src-kz-bybit-035",
    "src-kz-bybit-036",
    "src-kz-bybit-037",
    "src-kz-bybit-038",
    "src-kz-bybit-039",
    "sup-kz-bybit-001",
    "sup-kz-bybit-002",
    "sup-kz-bybit-003",
    "sup-kz-bybit-004"
  ],
  "conflictIds": [
    "cf-kz-bybit-001",
    "cf-kz-bybit-002"
  ],
  "alternativeExchangeIds": [],
  "liveVerificationState": "NOT_LIVE_VERIFIED"
}
